Phase,Sub-phase / Step,Key activities,Time range (approx.),Cost range (approx.),Comments
Clinical Development,Phase I,"Run first-in-human, SAD, MAD, food-effect, DDI or special-population studies to assess safety, tolerability, PK, PD and maximum tolerated or biologically active dose; review adverse events and dose-escalation decisions.","12-18 months","4-28 M USD",Per-patient costs yield $4-5.26M total; some estimates place Phase I spending at about $25M and $28M on average.
Clinical Development,Phase II,"Evaluate preliminary efficacy, dose-response, regimen selection and proof-of-concept in patients; monitor adverse events, protocol deviations, subgroup signals and biomarkers while refining endpoints and go or no-go criteria.","1-4 years","7-65 M USD",Phase II trials cost $7-20M in some sources; other studies report about $58.6M or about $65M.
Clinical Development,Phase III,"Confirm efficacy and safety in pivotal, randomised, often double-blind multicentre trials; manage recruitment, site performance, adjudication, data cleaning, statistical analysis and regulatory-readiness of the clinical package.","2-4 years","20-350 M USD",Reported costs range from $20-100M+ to about $350M; average spend reported around $282M or $255M.
Clinical Development,Phase IV,"Monitor long-term safety, effectiveness, adherence and real-world outcomes after approval; generate RWE, post-authorisation safety or efficacy studies, comparative effectiveness data and evidence for line extensions or label changes.","N/A","20-300 M USD",Ongoing for years to decades after approval; post-marketing surveillance programmes may cost $20-300M.
Post-market & Lifecycle,Pharmacovigilance,"Collect and analyse adverse event reports through systems like FAERS; implement risk mitigation and label updates. Includes Drug Safety, ICSR case processing, signal detection and signal management, benefit-risk assessments, RMP or PSMF maintenance, E2B(R3) compliance, MedDRA coding, SUSAR reporting, QPPV services, literature surveillance, label monitoring, and EudraVigilance gateway management.","N/A","20-300 M USD",Ongoing throughout product life; post-marketing surveillance programmes cost $20-300M.
Post-market & Lifecycle,Additional indications & formulations,"Extend lifecycle value through new indications, line extensions, formulations, combination products or special populations; run supplemental clinical studies, generate supporting evidence and manage sNDA, sBLA or variation filings.","1-2 years","20-100 M USD","New studies may take about 1-2 years and FDA review about 10 months; additional clinical trials for new indications generally cost tens of millions, using Phase II/III cost ranges."